,Summary Text,Sentiment Polarity,Twit_text,Sentiment Polarity Twitter
84,"Green hydrogen (hydrogen produced using renewable energy) is being touted as a clean alternative to fossil fuels that could power heavy industry and transport.
EU officials said this summer that they hoped to strike a deal to help Namibia develop its green hydrogen sector.
The southern African nation is set to open the continent’s first green hydrogen production plant in 2024, operated by French power company HDF Energy.
Namibia’s first hydrogen power plant is expected to be up and running in 2024, and there’s also a potential plan in place to partner with the EU on green hydrogen.
Geingos: It is clear that Namibia’s green hydrogen plans extend beyond domestic energy self-sufficiency.",-0.019607843137254905,"Cyber Monday might be commonplace today, but in 2006 it was just kicking off on the internet. Watch CNN's early coverage of what shopping for post-Thanksgiving discounts looked like. https://t.co/hYOEsxpw4v https://t.co/v2MmlumtT4",0.1
85,"But it’s coming under huge pressure from developed countries to abandon fossil fuels and shift to renewable energy in order to help save the climate.
AKINTUNDE AKINLEYE/EPA-EFE/ShutterstockLike the United States, Europe and Britain, Nigeria sees a prominent role for renewable energy, notwithstanding its investments into gas power.
“In Nigeria, clean energy is central to our government’s plan to transition to net-zero emissions,” Osinbajo, the vice president, continued.
In Nigeria, energy poverty is itself a major driver of emissions, according to Olu Verheijen, the founder of Lagos-based energy advisory business Latimer Energy.
This means that in some cases, certainly for Nigeria, gas has an important role to play in providing power.",0.2554315476190476,"Helena Bonham Carter is coming to the defense of two fellow members of the ""Harry Potter"" universe. https://t.co/a581Vfq9RF",0.0
86,"Aisha Salaudeen , CNN Written byIn a coffee shop in Lagos, Nigeria, visual artist Ekene Ngige was meeting with some colleagues when he had an accidental eureka moment that would change the course of his career.
He quickly noticed that the beverage created random patterns on paper, and thought: what if he used coffee to create art?
Nigerian visual artist Ekene Ngige in his studio.
Credit: CNNOn average, Ngige says it takes him about two weeks to a month to finish a coffee portrait.
Through some of his work, the artist shares a message of peace, encouraging people to forget their differences and embrace serenity.",-0.06333333333333332,"In a media conference on Monday, Tyler Adams was told by an Iranian journalist that he had been pronouncing the country’s name incorrectly. https://t.co/NAGVu7OSsE",0.0
87,"Bethlehem and Jerusalem CNN —At least six Palestinians were killed by the Israeli military on Tuesday, making it the deadliest day of violence in the occupied West Bank this year, CNN analysis of official Palestinian data showed.
Five were killed in the old city of Nablus during an Israeli raid there, according to the Palestinian Ministry of Health.
Israel said it was targeting Lion’s Den, a new militant group which emerged in Nablus this year and has targeted Israeli soldiers, killing at least two.
This year has been the deadliest in the West Bank for Palestinians killed by Israeli soldiers since 2015.
It has also been the deadliest year for Israelis and foreigners killed in attacks by Palestinians since 2015.",-0.14040404040404042,"Online Black Friday sales in the United States topped a record-breaking $9.1 billion this year, according to Adobe Analytics, kicking off a solid start to the holiday shopping season despite inflation and other economic concerns. https://t.co/PIKykCxkCA https://t.co/1zAYreR118",-0.022916666666666655
88,"Basel Christmas Market, SwitzerlandBasel Christmas Market consists of nearly 200 wooden stalls selling Christmas spices, decorations and candles.
Strasbourg Christmas Market, FranceDating back to 1570, Strasbourg Christmas Market lights up this French city annually.
The annual extravaganza, which extends across the Bourse, Place de la Monnaie, Grand Place, Place Sainte Catherine and Marche aux Poissons, is one of Belgium's biggest and most popular events.
Omar Marques/SOPA Images/LightRocket/Getty ImagesBudapest has two main festive markets -- St. Stephen's Basilica Christmas market and Vorosmarty Square Christmas market.
Hyde Park Winter WonderlandHyde Park Winter Wonderland is one of the most highly anticipated winter events in the UK capital.",0.2526666666666667,The label on a cup of Velveeta’s microwaveable mac and cheese says the meal only takes three and a half minutes to prepare. But a Florida woman says this is false – and she’s suing the manufacturer for $5 million. https://t.co/w8PGcmAAWK,-0.1888888888888889
89,"The picturesque town of Presicce in the sunny region of Puglia is the latest to enter the game with a tantalizing offer.
Officials say they will pay people up to 30,000 euros (roughly $30,000) to buy an empty dwelling and take up residency.
Roberto MicoccioPresicce traces its history to the middle ages, when settlements spread out around a Saracen fortress built by monks who dug crypts and underground olive mills as shelters for pirate raid survivors.
Beneath the main piazzas and lavish Baroque palazzos lies a network of 23 secret chambers and olive mills in which farmers, known as trappettari, spent months during harvest season, pressing olives in stone mills pushed by donkeys.
A subterranean olive mill.",-0.05416666666666667,"Dr. Anthony Fauci, the soon-retiring medical adviser to President Joe Biden, joins @jaketapper to talk about the Covid lockdowns in China as well as the triple threat posed by Covid, the flu and RSV in the US this winter. Watch here: https://t.co/tA1supImfb",0.0
