,Tweet Text,Likes,Time
0,EU ministers welcome Croatia to border-free zone but reject Romania and Bulgaria https://t.co/6e4JYrkRBw,70,2022-12-08 21:30:04+00:00
1,"NFL and Washington Commanders covered up sexual misconduct, says US report https://t.co/edet4JSUyR",50,2022-12-08 21:25:08+00:00
2,"Pope breaks down in tears over war in Ukraine
https://t.co/cFfhR1Fae4 https://t.co/tsWoxw2Ppo",348,2022-12-08 20:59:03+00:00
3,Activision Blizzard: US seeks to block Microsoft's $69bn acquisition https://t.co/Ux5UgXRiUe,106,2022-12-08 20:54:02+00:00
4,The moment released prisoners Brittney Griner and Viktor Bout cross on airport tarmac https://t.co/7MGwz1SQNz,156,2022-12-08 20:41:36+00:00
5,Putin vows to continue hitting Ukraine's power grid https://t.co/IwYTmlLT2A,211,2022-12-08 20:26:01+00:00
6,EuroMillions jackpot: Syndicate of 165 Belgians wins €143m https://t.co/8UTjXblagR,122,2022-12-08 20:04:40+00:00
7,Pope breaks down in tears over war in Ukraine https://t.co/TNJ1U1p6lP,682,2022-12-08 19:48:17+00:00
8,Footballer Victor Wanyama reverses international retirement for Kenya https://t.co/26Q7T8iklF,86,2022-12-08 18:46:12+00:00
9,DNA helps US police name young boy found dead in a box after 65 years https://t.co/RDn5xOlKpn,217,2022-12-08 18:21:31+00:00
10,Ireland to return mummified remains to Egypt https://t.co/RaHtFlkS6c,404,2022-12-08 17:59:01+00:00
11,Chief executive of the Qatar World Cup chief criticised for migrant worker death comments https://t.co/ZeegW37upt,107,2022-12-08 17:56:43+00:00
12,Peru swears in first female president Dina Boluarte https://t.co/4WLLzMnerY,425,2022-12-08 17:42:12+00:00
13,Remarkable space blast identified as black hole collision https://t.co/7cU3bpBRqu,273,2022-12-08 17:04:05+00:00
14,The most Googled word globally and in the US in 2022 is revealed https://t.co/HagX83lTSy,117,2022-12-08 16:45:04+00:00
15,"Risk of Russia using nuclear weapons has lessened, says German Chancellor Olaf Scholz https://t.co/I8amNvW81M",201,2022-12-08 16:33:03+00:00
16,South Koreans set to become one or two years younger as age system standardised https://t.co/WfyZlwA5Kt,249,2022-12-08 16:26:44+00:00
17,Working in extreme heat puts strain on foetus https://t.co/SHZoLkvQwR,123,2022-12-08 16:19:51+00:00
18,Peru's political whirlwind in three moments https://t.co/lG9NwWftte,98,2022-12-08 16:19:03+00:00
19,What we know so far after Prince Harry and Meghan release first episodes of Netflix series ⬇,313,2022-12-08 16:19:00+00:00
20,RT @BBCBreaking: US citizen Anne Sacoolas given eight month suspended sentence for causing death of teenage motorcyclist Harry Dunn in Nort…,0,2022-12-08 16:16:36+00:00
21,Who is the freed US basketball star Brittney Griner? https://t.co/kvbg2t9iZd,250,2022-12-08 16:06:05+00:00
22,"Elon Musk turns Twitter into ""hotel"" for staff https://t.co/eDPGblG9Ky",313,2022-12-08 15:45:14+00:00
23,"Wife of Brittney Griner says ""family is whole"" after release of US basketball player from Russian prison https://t.co/fI1OV02lqj",553,2022-12-08 15:30:05+00:00
24,"""We never stopped pushing for her release""

US President Biden speaks following release of basketball star Brittney Griner https://t.co/SkvedLIPPB",453,2022-12-08 15:17:06+00:00
25,"Prince Harry says he sacrificed ""everything that I know"" to join Meghan's ""world"" https://t.co/UNkeVpflUp",386,2022-12-08 15:06:06+00:00
26,"M23 rebels executed over 130 civilian in the Democratic Republic of Congo, UN investigation finds https://t.co/hxs4f3npj7",128,2022-12-08 14:45:06+00:00
27,"Global talks under way in Montreal ""last chance"" to reverse destruction of nature, warns UN biodiversity chief https://t.co/9PDYbWU2vt",230,2022-12-08 14:31:31+00:00
28,Wirecard trial of executives opens in German fraud scandal https://t.co/Gpu3JfGbqo,94,2022-12-08 14:05:51+00:00
29,US state Arkansas elects youngest black mayor in US https://t.co/sbvAqkWVoL,404,2022-12-08 13:29:45+00:00
30,"RT @BBCBreaking: US basketball star Brittney Griner freed by Russia in prisoner swap deal for ""Merchant of Death"" arms dealer Viktor Bout h…",0,2022-12-08 13:13:37+00:00
31,Celine Dion scraps tour dates as she reveals incurable health condition https://t.co/NbehuG8g1w,963,2022-12-08 13:07:15+00:00
32,"Rare 100-million-year-old fossil discovered by four friends in the Australian Outback

https://t.co/wUDWvOBHMo https://t.co/hXQlam8PU9",667,2022-12-08 13:04:58+00:00
33,Remarkable space blast identified as black hole collision https://t.co/94gii6VTV0,377,2022-12-08 11:31:23+00:00
34,"Prince Harry discusses what he says is a ""huge level of unconscious bias"" in the Royal Family

⬇️ Follow for the latest",363,2022-12-08 11:00:02+00:00
35,The most Googled word globally and in the US in 2022 is revealed https://t.co/rrZqQJ6jTE,124,2022-12-08 10:44:49+00:00
36,"""So much of what Meghan is, and how she is, is so similar to my mum”

Prince Harry draws comparisons between Meghan and Diana in Netflix series",1440,2022-12-08 10:30:34+00:00
37,Peru's ousted president detained by police in Lima https://t.co/1IjRGHi6li,240,2022-12-08 09:30:58+00:00
38,"Prince Harry says he sacrificed ""everything that I know"" to join Meghan's ""world"" https://t.co/TKqMaaXdKX",1437,2022-12-08 08:49:44+00:00
39,Iran carries out first execution over anti-government protests https://t.co/IJH3IXy2mM,500,2022-12-08 08:30:50+00:00
40,Netflix releases first Harry &amp; Meghan episodes https://t.co/YwflLhhF2O,195,2022-12-08 08:04:09+00:00
41,Why this Trump loyalist is willing to serve months in Rikers prison https://t.co/eS5c1RkUxt,152,2022-12-08 07:43:06+00:00
42,TikTok sued by US state over security and safety concerns https://t.co/DnrXygwWHG,207,2022-12-08 07:32:05+00:00
43,Harry and Meghan Netflix series launches amid controversy https://t.co/u0chc3bMmS,358,2022-12-08 07:17:03+00:00
44,The most Googled word globally and in the US in 2022 is revealed https://t.co/E3r39XOTKO,134,2022-12-08 07:03:02+00:00
45,Anger and fear in Australia as Bali bomber freed https://t.co/vNK7jTBEqp,180,2022-12-08 06:45:05+00:00
46,Remarkable space blast identified as black hole collision https://t.co/VXuYD0mwRj,427,2022-12-08 06:32:06+00:00
47,"Elon Musk turns Twitter into ""hotel"" for staff https://t.co/Uy3GvIgg6b",633,2022-12-08 06:14:11+00:00
48,World Cup 2022: Could Morocco win for Africa? https://t.co/Q4pOB0zqPo,292,2022-12-08 00:25:17+00:00
49,‘Doctors fitted a contraceptive coil without my consent’ https://t.co/OTLg6lHzai,140,2022-12-08 00:09:40+00:00
50,Sri Lanka crisis: The children going hungry as food prices soar https://t.co/iXFGpI6kYs,175,2022-12-08 00:09:40+00:00
51,Indonesia 'sex ban': Criminal code changes threaten other freedoms https://t.co/iGgaN3K8wQ,106,2022-12-08 00:09:40+00:00
52,Hope and worry in Beijing as China relaxes zero-Covid policy https://t.co/FRvBWZmxSE https://t.co/ozF00oRzaB,184,2022-12-07 23:30:09+00:00
53,UK minister accused of abject U-turn on Saudi torture comments https://t.co/foBOoGI0AU,90,2022-12-07 23:15:08+00:00
54,Morocco fans celebrate historic World Cup win https://t.co/5ZAfAacRNM https://t.co/RDyQMrK70U,310,2022-12-07 23:00:05+00:00
55,Former Theranos executive Sunny Balwani gets nearly 13 years in prison https://t.co/T5UhVDeGZ3,196,2022-12-07 22:57:59+00:00
56,Animal eye packages sent to embassies in Ukraine from Germany https://t.co/ZmpxdfqYzo,129,2022-12-07 22:45:12+00:00
57,Police release Idaho murder victims' belongings to grieving families https://t.co/5wMtHaBgJ6,91,2022-12-07 22:30:04+00:00
58,New York Times faces first major walkout since 1970s https://t.co/9d6wijNYub,213,2022-12-07 22:29:37+00:00
59,Court ruling paves way for abortion clinic buffer zones in Scotland https://t.co/d2jXh3ViSx,178,2022-12-07 22:15:06+00:00
60,Wordle: The most Googled word globally and in the US in 2022 https://t.co/4XLGigf3Xb,174,2022-12-07 22:07:03+00:00
61,Nigeria Afrobeats star D'banj arrested for youth fund fraud https://t.co/zfyB1mtgaA,165,2022-12-07 22:00:03+00:00
62,"RT @BBCBreaking: Peru's president tries to dissolve parliament, is impeached, and then replaced in a day of political drama https://t.co/lA…",0,2022-12-07 21:45:17+00:00
63,"Nuclear risk is rising, but we are not mad, Russia’s President Vladimir Putin says
https://t.co/lua9MrUCtx",797,2022-12-07 21:45:03+00:00
64,Peru leader dissolves Congress hours before impeachment bid https://t.co/36JRraEBTH,160,2022-12-07 21:30:07+00:00
65,"RT @BBCSounds: What role have conspiracy theories played in the rise of Germany's Reichsbürger movement?

Misinformation &amp; Social Media Cor…",0,2022-12-07 21:26:53+00:00
66,Oldest DNA reveals two-million-year-old lost world https://t.co/S0Cq7qpLlm,455,2022-12-07 21:16:02+00:00
67,UK man jailed for brother's Covid death fraud claim https://t.co/ynRBzF63Kb,113,2022-12-07 21:00:12+00:00
68,"People look to San Francisco for progressive ideas, says mayor https://t.co/Pe0ublkG5T",191,2022-12-07 20:44:04+00:00
69,What you need to know before the World Cup quarter-finals https://t.co/CdrKXZUG6f,74,2022-12-07 20:30:07+00:00
70,Hope and worry in Beijing as key China zero-Covid policies scrapped https://t.co/wTnKwXopu0,129,2022-12-07 20:16:07+00:00
71,'Migrants' flee plane after emergency Barcelona landing following woman faking labour https://t.co/JuM6heyVu7,138,2022-12-07 20:00:12+00:00
72,German 'crackpot' movement turns radical and dangerous https://t.co/ELizMPzrgq,247,2022-12-07 19:35:56+00:00
73,US Supreme Court hears case that could reshape election laws https://t.co/oLZgjHIEge,150,2022-12-07 19:07:11+00:00
74,The good Samaritans helping Indians find jobs in the US after major tech layoffs https://t.co/VWDluESc0R,136,2022-12-07 18:38:41+00:00
75,"Woman whose family died in tower block fire in China blames government for their death

Beijing denies their zero-Covid policy is to blame

https://t.co/LDrUCaMcMP https://t.co/tYAiwp4NQp",332,2022-12-07 18:30:00+00:00
76,"Missing facts over woman's Qatar death, says coroner https://t.co/LOoCM591rI",142,2022-12-07 18:02:51+00:00
77,Kenya looks to criminalise doping in athletics after string of cases https://t.co/5sWsYdeJk4,95,2022-12-07 17:39:54+00:00
78,"What Raphael Warnock's win in means for him, the US Senate and Georgia https://t.co/1AHBycW8vZ",180,2022-12-07 17:16:37+00:00
79,Nigerians warned of TikTok video challenge virus https://t.co/CWyxwMG1TT,111,2022-12-07 17:08:05+00:00
80,Killer of South African anti-apartheid hero Chris Hani freed https://t.co/qp4EyLSSwS,133,2022-12-07 16:57:05+00:00
81,E-cigarette manufacturer Juul Labs agrees thousands of US settlements https://t.co/PhtuwEyYI8,139,2022-12-07 16:35:04+00:00
82,"Polygamous cult leader Samuel Bateman had 20 wives, FBI says https://t.co/FynKqjpuK8",299,2022-12-07 16:19:15+00:00
83,"Iraqi activist jailed over tweet ""insulting"" Iran-backed militia force https://t.co/tBVWxrOXn6",138,2022-12-07 16:05:09+00:00
84,Operating on a baby in the dark after missiles hit Ukrainian capital Kyiv https://t.co/rOrsQ0Gy4s https://t.co/HjunG3Gl97,281,2022-12-07 15:46:52+00:00
85,"Woman whose family died in tower block fire in China blames government for their death

Beijing denies their zero-Covid policy is to blame

https://t.co/LDrUCb3Obp",136,2022-12-07 15:36:39+00:00
86,Ukraine's President Volodymyr Zelensky named Time Magazine's 2022 Person of the Year https://t.co/dXbcpyN1jX,5568,2022-12-07 15:34:03+00:00
87,https://t.co/lTc8BUobc4,513,2022-12-07 15:26:28+00:00
88,Elon Musk criticises investigation into offices at Twitter HQ being turned into bedrooms https://t.co/733XntDX08,257,2022-12-07 15:18:07+00:00
89,"What's behind the protests and dissent against the Chinese leader Xi Jinping?

Listen to the latest episode of The Briefing Room @BBCSounds https://t.co/abDw3Bx9Gq",122,2022-12-07 14:58:01+00:00
90,AJ Wavy's rise from TikTok mashups to a record contract with Sony https://t.co/XFjrEnE08V,87,2022-12-07 14:43:02+00:00
91,Taliban conduct first public execution since return to power https://t.co/LNTvQu9Acu,215,2022-12-07 14:34:01+00:00
92,How Russia is rebuilding key bridge to Crimean peninsula after October explosion https://t.co/TEdoxZQulE,157,2022-12-07 14:17:31+00:00
93,Ukraine's President Volodymyr Zelensky named Time Magazine's 2022 Person of the Year,30238,2022-12-07 14:00:04+00:00
94,Nintendo lands Call of Duty in 10-year Microsoft deal https://t.co/3aWLL1MpwD,258,2022-12-07 13:46:04+00:00
95,RT @BBCBreaking: UK's former health secretary Matt Hancock says he will not stand at the next general election https://t.co/vXHJvazgOF,0,2022-12-07 13:41:58+00:00
96,New Zealand places child in anti-vax blood case in custody https://t.co/lXJv2dxFFs,216,2022-12-07 13:30:58+00:00
97,US Senate unanimously passes bill to curb private ownership of big cats https://t.co/DZDLlVaDOv,1098,2022-12-07 13:04:23+00:00
98,"Operating on a baby in the dark after missiles hit Ukrainian capital Kyiv 

https://t.co/rOrsQ0G0eU https://t.co/tAQQCYrVM8",536,2022-12-07 12:33:04+00:00
99,Islamic State members' relatives 'stuck in limbo' in Syrian camps https://t.co/d8Fu7TCLPz,133,2022-12-07 12:03:29+00:00
